### ISSUE TITLE
(latest version) write method does not work

### ISSUE THREAD

**Issue by tcloaa** [influxdata/influxdb-python#467]
I have the issue here..

I only would like to write single point, so I may need the `write` method. (instead of `write_points`)

And my JSON body is like:

```
json_body = {
                "measurement": "message",
                "tags": {
                    "tag1": "99999",
                    "tag2": "99999"
                },
                "fields": {
                    "field1": 9999,
                    "field2": 99999
                },
                "time": 1496625370893587000
            }

```

With calling method:
```
client.write(json_body, protocol=u'json')            
```

And I got error: 
```
  File "/usr/local/lib/python2.7/dist-packages/influxdb/line_protocol.py", line 121, in make_lines
    for point in data['points']:
KeyError: u'points'

```

**Comment by tcloaa** [comment]
It is really weird that `def write()` has to call:

```python
if protocol == 'json':
    data = make_lines(data, precision).encode('utf-8')
```

where `make_lines`:
```python
for point in data['points']:
```

If I would only want to write 1 single point, then my json(dict) shall naturally look like:

 json_body = {
                "measurement": "message",
                "tags": {
                    "tag1": "99999",
                    "tag2": "99999"
                },
                "fields": {
                    "field1": 9999,
                    "field2": 99999
                },
                "time": 1496625370893587000
            }

**Comment by sebito91** [comment]
Thanks for raising this, and sorry for the delay in getting back to you. Will look at this and address ASAP.

**Comment by tcloaa** [comment]
Thanks,

Currently, for your `write`, it says it requires a `dict`, so if we try this:

```
json_body = {
                "measurement": "message",
                "tags": {
                    "tag1": "99999",
                    "tag2": "99999"
                },
                "fields": {
                    "field1": 9999,
                    "field2": 99999
                },
                "time": 1496625370893587000
            }
```

Then in `client.write()`, we shall call this function `client.write([json_body])` (it works!), which becomes a list again...

**Comment by sebito91** [comment]
For sanity, can you please confirm the version of the app you're using? I've dug into this some more and the main issue is the order of your data entry...to be fair, this is not documented properly at the moment, sorry! :/

The new syntax is expected as follows, where the `tags` are listed outside of all `points` for which they are applicable (which include the required `fields` and optional `time`):

```
    json_body = {
        "tags": {
            "empty_tag": "",
            "none_tag": None,
            "integer_tag": 2,
            "string_tag": "hello"
            },
        "points": [
            {
                "measurement": "test",
                "fields": {
                    "string_val": "hello!",
                    "int_val": 1,
                    "float_val": 1.1,
                    "none_field": None,
                    "bool_val": True,
                    },
                "time": 1497678083000000000,
                }
            ]
        }

    ret = newClient.write(json_body, params={'db': 'sebtest'})
    print ret
```
Also, you don't need to specify the `protocol` unless you're sending the official line protocol; the default is expecting json data.

Do you want to give this another shot with the revised format and let us know?

**Comment by tcloaa** [comment]
I think I am using the latest version of the client. (apt-get install)．

IMO, the best format shall be:
```
json_body = {
                "measurement": "message",
                "tags": {
                    "tag1": "99999",
                    "tag2": "99999"
                },
                "fields": {
                    "field1": 9999,
                    "field2": 99999
                },
                "time": 1496625370893587000
            }
```
just like a normal json (dict).

And therefore we can use `newClient.write(json_body)`. (for now I have to call it like `oldClient.write([json_body])` even for writing 1 record.

To be frankly speaking, the design of 

```
    json_body = {
        "tags": {
            "empty_tag": "",
            "none_tag": None,
            "integer_tag": 2,
            "string_tag": "hello"
            },
        "points": [
            {
                "measurement": "test",
                "fields": {
                    "string_val": "hello!",
                    "int_val": 1,
                    "float_val": 1.1,
                    "none_field": None,
                    "bool_val": True,
                    },
                "time": 1497678083000000000,
                }
            ]
        }
```
is confusing since in InfluxDB, we only have `time`, `tags`, `field`, `measurement`. (no border to add `points` here. )

**Comment by sebito91** [comment]
The standard, supported method for [writing](http://docs.influxdata.com/influxdb/v1.2/guides/writing_data/) data to InfluxDB (and the TICK stack) is to write line protocol. The JSON endpoint is deprecated, but support remains in clients like influxdb-python to help users seamlessly cut over. This is why you see the client calling `make_lines` before actually formatting the http request. The limitation of the old schema is the ability to write multiple points, aka lines or groups of measurements in one json_body. With the new setup, you can define multiple points that get converted to proper line protocol and get sent to the backend. In all cases, tags are optional but points are required; the new structure would allow you to define a particular tagset across a heap of measurements if you wanted.

In either scenario you should not need to pass your json_body as a list. The default expectation is json and will parse the data accordingly (provided it's valid syntax and matches the new structure).

**Comment by tcloaa** [comment]
Hi,
Thanks for the reply.

May I ask that,

1. How can I upgrade InfluxDB-Python so that I can catch up with this new setup?
2. for method `write`, is it always connecting and disconnecting the DB all the time? If I may have loop to sequentially insert data into InfluxDB, will it be too inefficient?

Thanks,

**Comment by sebito91** [comment]
We've actually added the instructions to update in the README, but you can also do it as listed [here](https://pypi.python.org/pypi/influxdb/4.1.1).

For your second question, the connections that are established are not long-running TCP connections. Instead you're creating an `HTTP POST` that has the `keep-alive` header set but only for the duration of the write itself. Each call to the `write` function is idempotent and returns when a retcode is received for the `HTTP POST`. In InfluxDB, the retcode is any one of the [following](https://docs.influxdata.com/influxdb/v1.2/tools/api/#write):

![statuscodes](https://user-images.githubusercontent.com/3159454/27895671-ef423ac4-61d9-11e7-9ff9-42aeb800fee0.png)

Here is an example:
```
23:21:30.086209 IP (tos 0x0, ttl 64, id 663, offset 0, flags [DF], proto TCP (6), length 432)
    localhost.localdomain.52844 > localhost.localdomain.d-s-n: Flags [P.], cksum 0xffa4 (incorrect -> 0xdf53), seq 381:761, ack 174, win 350, options [nop,nop,TS val 3759584023 ecr 3759530578], length 380
E.....@.@.8..........l.....^.......^.......
.......RPOST /write?db=sebtest HTTP/1.1
Host: localhost:8086
Connection: keep-alive
Accept-Encoding: gzip, deflate
Accept: text/plain
User-Agent: python-requests/2.17.3
Content-type: application/octet-stream
Content-Length: 115
Authorization: Basic cm9vdDpyb290

test,integer_tag=2,string_tag=hello bool_val=True,float_val=1.1,int_val=1i,string_val="hello!" 1497678083000000000

23:21:30.100862 IP (tos 0x0, ttl 64, id 59040, offset 0, flags [DF], proto TCP (6), length 225)
    localhost.localdomain.d-s-n > localhost.localdomain.52844: Flags [P.], cksum 0xfed5 (incorrect -> 0x5b62), seq 174:347, ack 761, win 359, options [nop,nop,TS val 3759584038 ecr 3759584023], length 173
E.....@.@.Ut...........l...........g.......
...&....HTTP/1.1 204 No Content
Content-Type: application/json
Request-Id: 95ce2f30-6202-11e7-8016-000000000000
X-Influxdb-Version: 1.2.4
Date: Thu, 06 Jul 2017 04:21:30 GMT


23:21:30.100912 IP (tos 0x0, ttl 64, id 664, offset 0, flags [DF], proto TCP (6), length 52)
    localhost.localdomain.52844 > localhost.localdomain.d-s-n: Flags [.], cksum 0xfe28 (incorrect -> 0x51dc), seq 761, ack 347, win 359, options [nop,nop,TS val 3759584038 ecr 3759584038], length 0
E..4..@.@.:*.........l.........F...g.(.....
...&...&
```

**Comment by sebito91** [comment]
@aviau READY TO CLOSE

**Comment by ferhatguneri** [comment]
Hello,

I'v tried a lot of times but I still get error Below. Could you please help me about that?

Here is code and error

    payload = {
    "measurement": "virtualmachine",
    "tags": {
        "name": name,
        "instanceUuid": instanceUuid
    },
    "time": datetime.datetime.now().isoformat(),
    "fields": {
                "version": version,
                "template": template,
                "memorySizeMB": memorySizeMB,
                "numCpu":numCpu,
                "numEthernetCards": numEthernetCards,
                "numVirtualDisks": numVirtualDisks,
                "committedStorage": committedStorage,
                "uncommittedStorage": uncommittedStorage,
                "powerState":powerState,
                "tools_version": tools_version,
                "ip_address": ip_address,
                "hostName": hostName,
                "vmPathName": vmPathName,
                "guestFullName": guestFullName
    }
}
    print payload
    client.write([payload])



Traceback (most recent call last):
  File "influxdb/test.py", line 107, in <module>
    print_vm_info(child)
  File "influxdb/test.py", line 92, in print_vm_info
    client.write([payload])
  File "/usr/local/lib/python2.7/dist-packages/influxdb/client.py", line 315, in write
    data = make_lines(data, precision).encode('utf-8')
  File "/usr/local/lib/python2.7/dist-packages/influxdb/line_protocol.py", line 126, in make_lines
    static_tags = data.get('tags')
AttributeError: 'list' object has no attribute 'get'

**Comment by a-l-t-e-r** [comment]
Same problem here at latest version. No fix yet.
